timestamp,topic,qtype,question,correct,user_answer,correct_answer
2025-10-16 10:07,General,Short Answer,Who cared deeply for Dorothy?,1,aunt em,Aunt Em
2025-10-16 10:07,General,Short Answer,What was the name of the magical place?,1,land of oz,Land of Oz
2025-10-16 10:07,General,Short Answer,What was Dorothy's black dog's name?,1,toto,Toto
2025-10-16 10:07,General,Short Answer,Who was Dorothy's uncle?,0,unlce henry,Uncle Henry
2025-10-16 10:07,General,Short Answer,What caused Dorothy's house to go far away to?,1,land of oz,Land of Oz
